template_section,var_uid,icasa_dataset,icasa_subset,icasa_group,icasa_subgroup,icasa_header_long,icasa_header_short,icasa_description,icasa_unit,icasa_type,icasa_minval,icasa_maxval,data_model,section,header,synonyms,header_long,DQ_mindat,description,unit,code_mappings,fun_header,fun_header_args,fun_values,fun_values_args,comments
WEATHER_METADATA,660,WEATHER,WEATHER_STATION,STATION_METADATA,,growing_season_start_day,GSST,Growing season start day,doy,single,1,366,dwd_old,,,,,,,,,,,,,
WEATHER_METADATA,661,WEATHER,WEATHER_STATION,STATION_METADATA,,start_yr_weather_summary,START_YR,Start of summary period weather summary,date,single,,,dwd_old,,,,,,,,,,,,,
WEATHER_METADATA,662,WEATHER,WEATHER_STATION,STATION_METADATA,,maximum_temp_avg_year,TMXY,"Temperature maximum, yearly average",degree_C,single,,,dwd_old,,,,,,,,,,,,,
WEATHER_METADATA,663,WEATHER,WEATHER_STATION,STATION_METADATA,,minimum_temp_avg_year,TMNY,"Temperature minimum, yearly average",degree_C,single,,,dwd_old,,,,,,,,,,,,,
WEATHER_METADATA,664,WEATHER,WEATHER_STATION,STATION_METADATA,,rainfall_yearly_total,RAIY,"Rainfall, yearly total",mm,single,0,,dwd_old,,,,,,,,,,,,,
WEATHER_METADATA,665,WEATHER,WEATHER_STATION,STATION_METADATA,,solar_rad_yearly_avg,SRAY,"Solar radiation, yearly average",MJ/(m2.d),single,0,,dwd_old,,,,,,,,,,,,,
WEATHER_METADATA,666,WEATHER,WEATHER_STATION,STATION_METADATA,,angstrom_coef_a_year,ANGA,"Angstrom A coefficient, yearly",,single,,,dwd_old,,,,,,,,,,,,,
WEATHER_METADATA,667,WEATHER,WEATHER_STATION,STATION_METADATA,,angstrom_coef_b_year,ANGB,"Angstrom B coefficient, yearly",,single,,,dwd_old,,,,,,,,,,,,,
WEATHER_METADATA,668,WEATHER,WEATHER_STATION,STATION_METADATA,,psychrometric_constant ,PSYCON,Psychrometric constant ,kPa/degree_C,single,,,dwd_old,,,,,,,,,,,,,
WEATHER_METADATA,669,WEATHER,WEATHER_STATION,STATION_METADATA,,flag_for_summary_data,FLAGA,Flag to identify summary data with specific problems or significance,,text,,,dwd_old,,,,,,,,,,,,,
WEATHER_METADATA,670,WEATHER,WEATHER_STATION,STATION_METADATA,,psychrometer_ventilation,PSYVNT,Psychrometer ventilation (ventilated or natural air flow),,text,,,dwd_old,,,,,,,,,,,,,
WEATHER_METADATA,671,WEATHER,WEATHER_STATION,WEATHER_GENER_PARMS,,weather_station_id,WST_ID,Weather station identifier to link to site information,1,single,,,,,,,,,,,,,,,,
WEATHER_METADATA,672,WEATHER,WEATHER_STATION,WEATHER_GENER_PARMS,,solar_rad_all_day_mon_av,SAMN,"Solar radiation, all days, monthly avera",MJ/(m2.d),single,,,,,,,,,,,,,,,,
WEATHER_METADATA,673,WEATHER,WEATHER_STATION,WEATHER_GENER_PARMS,,solar_rad_dry_d_mon_sd,SDSD,"Solar radiation, dry days, monthly st de",MJ/(m2.d),single,,,,,,,,,,,,,,,,
WEATHER_METADATA,674,WEATHER,WEATHER_STATION,WEATHER_GENER_PARMS,,solar_rad_dry_day_mon_av,SDMN,"Solar radiation, dry days, monthly avera",MJ/(m2.d),single,,,,,,,,,,,,,,,,
WEATHER_METADATA,675,WEATHER,WEATHER_STATION,WEATHER_GENER_PARMS,,solar_rad_wet_d_mon_avg,SWMN,"Solar radiation, wet days, monthly avera",MJ/(m2.d),single,,,,,,,,,,,,,,,,
WEATHER_METADATA,676,WEATHER,WEATHER_STATION,WEATHER_GENER_PARMS,,solar_rad_wet_d_mon_sd,SWSD,"Solar radiation, wet days, monthly st de",MJ/(m2.d),single,,,,,,,,,,,,,,,,
WEATHER_METADATA,677,WEATHER,WEATHER_STATION,WEATHER_GENER_PARMS,,sunshine_duration_month,SHMN,"Daily sunshine duration, monthly average",%,single,0,95,,,,,,,,,,,,,,
WEATHER_METADATA,678,WEATHER,WEATHER_STATION,WEATHER_GENER_PARMS,,temp_max_all_days_mon_av,XAMN,"Temperature maximum, all days, monthly average",degree_C,single,,,,,,,,,,,,,,,,
WEATHER_METADATA,679,WEATHER,WEATHER_STATION,WEATHER_GENER_PARMS,,temp_max_dry_days_mon_av,XDMN,"Temperature maximum, dry days, monthly average",degree_C,single,,,,,,,,,,,,,,,,
WEATHER_METADATA,680,WEATHER,WEATHER_STATION,WEATHER_GENER_PARMS,,temp_max_dry_days_st_dev,XDSD,"Temperature maximum, dry days, standard deviation",degree_C,single,,,,,,,,,,,,,,,,
WEATHER_METADATA,681,WEATHER,WEATHER_STATION,WEATHER_GENER_PARMS,,temp_max_wet_days_mon_av,XWMN,"Temperature maximum, wet days, monthly average",degree_C,single,,,,,,,,,,,,,,,,
WEATHER_METADATA,682,WEATHER,WEATHER_STATION,WEATHER_GENER_PARMS,,temp_max_wet_days_st_dev,XWSD,"Temperature maximum, wet days, standard deviation",degree_C,single,,,,,,,,,,,,,,,,
WEATHER_METADATA,683,WEATHER,WEATHER_STATION,WEATHER_GENER_PARMS,,temp_min_all_days_mon_av,NAMN,"Temperature minimum, monthly average of all days",degree_C,single,,,,,,,,,,,,,,,,
WEATHER_METADATA,684,WEATHER,WEATHER_STATION,WEATHER_GENER_PARMS,,temp_min_all_days_mon_sd,NASD,"Temperature minimum, standard dev. for all days in a month",degree_C,single,,,,,,,,,,,,,,,,
WEATHER_METADATA,685,WEATHER,WEATHER_STATION,WEATHER_GENER_PARMS,,angstrom_coef_a_month,AMTH,"Angstrom A coefficient, monthly",,single,,,,,,,,,,,,,,,,
WEATHER_METADATA,686,WEATHER,WEATHER_STATION,WEATHER_GENER_PARMS,,angstrom_coef_b_month,BMTH,"Angstrom B coefficient, monthly",,single,,,,,,,,,,,,,,,,
WEATHER_METADATA,687,WEATHER,WEATHER_STATION,WEATHER_GENER_PARMS,,rainfall_parm_alpha,ALPHA,"Rainfall distribution scale parameter,",1/mm2,single,,,,,,,,,,,,,,,,
WEATHER_METADATA,688,WEATHER,WEATHER_STATION,WEATHER_GENER_PARMS,,rainfall_total,RTOT,Monthly rainfall total,mm,single,0,,,,,,,,,,,,,,,
WEATHER_METADATA,689,WEATHER,WEATHER_STATION,WEATHER_GENER_PARMS,,month,MONTH,Month of year,1,single,,,,,,,,,,,,,,,,
WEATHER_METADATA,690,WEATHER,WEATHER_STATION,WEATHER_GENER_PARMS,,prob_dry-wet_sequence,PDW,Probability of a dry-wet sequence,1,single,,,,,,,,,,,,,,,,
WEATHER_METADATA,691,WEATHER,WEATHER_STATION,WEATHER_GENER_PARMS,,rainy_days,RNUM,Rainy days,1/month,single,0,,,,,,,,,,,,,,,
WEATHER_METADATA,692,WEATHER,WEATHER_STATION,WEATHER_GENER_PARMS,,weather_gen_notes,WG_NOTES,Additional information describing weather generator parameters,text,text,,,,,,,,,,,,,,,,
WEATHER_DAILY,695,WEATHER,WEATHER_STATION,WEATHER_DAILY,,year,YEAR,Year (4 digits) for daily weather data,date,single,,,dwd_old,,,,,,,,,,,,,
WEATHER_DAILY,696,WEATHER,WEATHER_STATION,WEATHER_DAILY,,day_of_year,DOY,Day of year for daily weather record,doy,single,1,366,dwd_old,,,,,,,,,,,,,
WEATHER_DAILY,703,WEATHER,WEATHER_STATION,WEATHER_DAILY,,ozone_daily_max,OZONX,Daily maximum ozone concentration,ppb,single,,,dwd_old,,,,,1,,,,,,,,
WEATHER_DAILY,704,WEATHER,WEATHER_STATION,WEATHER_DAILY,,CO2_conc_atmosphere_daily,CO2D,"CO2 concentration, atmospheric average over day",vpm,single,,,dwd_old,,,,,,,,,,,,,
WEATHER_DAILY,705,WEATHER,WEATHER_STATION,WEATHER_DAILY,,cloudiness_factor,CLDD,"Cloudiness factor, relative",1,single,,,dwd_old,,,,,,,,,,,,,
WEATHER_DAILY,706,WEATHER,WEATHER_STATION,WEATHER_DAILY,,PAR_photon_flux_density,PARD,,,,,,dwd_old,,,,,,,,,,,,,CHECK: no icasa equivalent
WEATHER_DAILY,707,WEATHER,WEATHER_STATION,WEATHER_DAILY,,radiation_shortwave,DTR,"Solar radiation, daily shortwave",MJ/(m2.d),single,0,,dwd_old,,,,,,,,,,,,,
WEATHER_DAILY,708,WEATHER,WEATHER_STATION,WEATHER_DAILY,,sunshine_duration,SUNH,Sunshine duration over 24 h period,hr,single,0,100,dwd_old,,,,,,,,,,,,,
WEATHER_DAILY,709,WEATHER,WEATHER_STATION,WEATHER_DAILY,,dry_bulb_temper_avg_day,TDRY,"Temperature, dry-bulb, daily average",degree_C,single,,,dwd_old,,,,,,,,,,,,,
WEATHER_DAILY,710,WEATHER,WEATHER_STATION,WEATHER_DAILY,,evaporation_pan,EVAP,"Evaporation, pan",mm/d,single,0,,dwd_old,,,,,,,,,,,,,CHECK: no icasa equivalent
WEATHER_DAILY,710,WEATHER,WEATHER_STATION,WEATHER_DAILY,,evaporation_pan,EVAP,"Evaporation, pan",mm/d,single,0,,dwd_old,,,,,,,,,,,,,CHECK: no icasa equivalent
WEATHER_DAILY,711,WEATHER,WEATHER_STATION,WEATHER_DAILY,,evapotranspiration_reference,ETO,"Evapotranspiration, reference",mm/d,single,0,,dwd_old,,,,,,,,,,,,,
WEATHER_DAILY,712,WEATHER,WEATHER_STATION,WEATHER_DAILY,,temperature_wet-bulb,TWET,"Temperature, wet-bulb",degree_C,single,,,dwd_old,,,,,,,,,,,,,
WEATHER_DAILY,713,WEATHER,WEATHER_STATION,WEATHER_DAILY,,daylength_sunrise_sunset,DAYD,Daylength (sunrise-sunset),h,single,0,,dwd_old,,,,,,,,,,,,,
WEATHER_DAILY,714,WEATHER,WEATHER_STATION,WEATHER_DAILY,,daylength_3_deg,DA3D,Daylength (3 deg basis),h,single,0,,dwd_old,,,,,,,,,,,,,
WEATHER_DAILY,715,WEATHER,WEATHER_STATION,WEATHER_DAILY,,daylength_twilight_basis,TWLD,Daylength (twilight to twilight),h,single,0,,dwd_old,,,,,,,,,,,,,
WEATHER_DAILY,716,WEATHER,WEATHER_STATION,WEATHER_DAILY,,ambient_CO2_conc,ACO2,"CO2, ambient",ppm,single,0,,dwd_old,,,,,,,,,,,,,
WEATHER_DAILY,717,WEATHER,WEATHER_STATION,WEATHER_DAILY,,flag_for_weather_data,FLAGW,Flag to identify daily weather data with specific problems or significance,,text,,,dwd_old,,,,,,,,,,,,,
WEATHER_DAILY,718,WEATHER,WEATHER_STATION,WEATHER_DAILY,,relative_humidity_min ,RHUMD,Relative humidity at maximum daily temperature (or minimum daily relative humidity),%,single,,,dwd_old,,,,,,,,,,,,,
WEATHER_DAILY,719,WEATHER,WEATHER_STATION,WEATHER_DAILY,,relative_humidity_max,RHMXD,"Relative humidity, maximum daily value",%,single,,,dwd_old,,,,,,,,,,,,,
WEATHER_DAILY,721,WEATHER,WEATHER_STATION,WEATHER_DAILY,,temp_average_daily,TAVD,"Temperature of air, average daily",degree_C,single,,,dwd_old,,,,,,,,,,,,,
WEATHER_DAILY,722,WEATHER,WEATHER_STATION,WEATHER_DAILY,,temp_avg_daylight,TDYD,"Temperature of air, average during daylight hours",degree_C,single,,,dwd_old,,,,,,,,,,,,,
WEATHER_DAILY,723,WEATHER,WEATHER_STATION,WEATHER_DAILY,,temp_avg_daily_air,TGAD,"Temperature, average daily air, growth",degree_C,single,,,dwd_old,,,,,,,,,,,,,
WEATHER_DAILY,724,WEATHER,WEATHER_STATION,WEATHER_DAILY,,temp_avg_daylight_air,TGRD,"Temperature, average air, daylight hours",degree_C,single,,,dwd_old,,,,,,,,,,,,,
WEATHER_DAILY,725,WEATHER,WEATHER_STATION,WEATHER_DAILY,,min_temp_average,TMNA,"Temperature of air, minimum, averaged over time period (e.g., 5 days)",degree_C,single,,,dwd_old,,,,,,,,,,,,,
WEATHER_DAILY,726,WEATHER,WEATHER_STATION,WEATHER_DAILY,,max_temp_average,TMXA,"Temperature of air, maximum, averaged over time period (e.g., 5 days)",degree_C,single,,,dwd_old,,,,,,,,,,,,,
WEATHER_DAILY,727,WEATHER,WEATHER_STATION,WEATHER_DAILY,,vapor_pressure,VPRSD,"Vapor pressure, average daily",kPa,single,,,dwd_old,,,,,,,,,,,,,
WEATHER_DAILY,728,WEATHER,WEATHER_STATION,WEATHER_DAILY,,rainfall,PRED,Rainfall,mm/d,single,0,,dwd_old,,,,,,,,,,,,,
WEATHER_DAILY,729,WEATHER,WEATHER_STATION,WEATHER_DAILY,,weather_daily_comments,WD_COMMENT,Additional information on a single day of weather,text,text,,,,,,,,,,,,,,,,
OBSERV_DATA_LINKS,730,EXPERIMENT,MEASURED_DATA,OBSERV_DATA_LINKS,,observ_treat_ID,TREAT_ID,"Treatment id for observed data, unique internal ID",1,single,,,,,,,,,,,,,,,,
OBSERV_DATA_LINKS,732,EXPERIMENT,MEASURED_DATA,OBSERV_DATA_LINKS,,replicate_number,RP,Replicate number,1,single,,,,,,,,,,,,,,,,
OBSERV_DATA_LINKS,733,EXPERIMENT,MEASURED_DATA,OBSERV_DATA_LINKS,,sub_block_number,SBLK,Any blocking within replicates as in a lattice design,number,single,,,,,,,,,,,,,,,,
OBSERV_DATA_LINKS,734,EXPERIMENT,MEASURED_DATA,OBSERV_DATA_LINKS,,sequence_number,SQ,Sequence number,1,single,,,,,,,,,,,,,,,,
OBSERV_DATA_LINKS,735,EXPERIMENT,MEASURED_DATA,OBSERV_DATA_LINKS,,option_for_crop_in_seq,OP,Option for crop in sequence,1,single,,,,,,,,,,,,,,,,
OBSERV_DATA_LINKS,736,EXPERIMENT,MEASURED_DATA,OBSERV_DATA_LINKS,,crop_component_number,CO,Crop component number,1,single,,,,,,,,,,,,,,,,
OBSERV_DATA_LINKS,737,EXPERIMENT,MEASURED_DATA,OBSERV_DATA_LINKS,,observation_note,OBS_NOTE,Additional details describing a single row of observations,text,text,,,,,,,,,,,,,,,,
SM_DEVELOPMENT,738,EXPERIMENT,MEASURED_DATA,SUMMARY,SM_DEVELOPMENT,maturity_day_of_year,MDOY,"Growth stage of physiol. maturity, as day of year",doy,single,1,366,,,,,,,,,,,,,,
SM_DEVELOPMENT,740,EXPERIMENT,MEASURED_DATA,SUMMARY,SM_DEVELOPMENT,anthesis_day_of_year,ADOY,Anthesis date as day of year,doy,single,1,366,,,,,,,,,,,,,,
SM_DEVELOPMENT,741,EXPERIMENT,MEASURED_DATA,SUMMARY,SM_DEVELOPMENT,anthesis_dap,ADAP,"Growth stage as days after planting, anthesis",dap,single,10,700,,,,,,,,,,,,,,
SM_DEVELOPMENT,742,EXPERIMENT,MEASURED_DATA,SUMMARY,SM_DEVELOPMENT,physiologic_maturity_dap,MDAP,"Growth stage of physiol. maturity, as days after planting",dap,single,10,,,,,,,,,,,,,,,
SM_DEVELOPMENT,744,EXPERIMENT,MEASURED_DATA,SUMMARY,SM_DEVELOPMENT,harvest_dap,HDAP,Growth stage as days after planting,dap,single,10,800,,,,,,,,,,,,,,
SM_DEVELOPMENT,747,EXPERIMENT,MEASURED_DATA,SUMMARY,SM_DEVELOPMENT,growth_stage_harvest,GSTH,Growth stage when harvest occurs,,text,,,,,,,,,,,,,,,,
SM_DEVELOPMENT,748,EXPERIMENT,MEASURED_DATA,SUMMARY,SM_DEVELOPMENT,panicle_initiation_dap,IDAP,"Growth stage of panicle initiation, as days after planting",dap,single,10,,,,,,,,,,,,,,,
SM_DEVELOPMENT,749,EXPERIMENT,MEASURED_DATA,SUMMARY,SM_DEVELOPMENT,first_pod_set_days,PD1P,"Growth stage of first pod, as days after planting",dap,single,10,,,,,,,,,,,,,,,
SM_DEVELOPMENT,750,EXPERIMENT,MEASURED_DATA,SUMMARY,SM_DEVELOPMENT,full_pod_days,PDFP,"Growth stage of full-sized pod, as days after planting",dap,single,10,,,,,,,,,,,,,,,
SM_DEVELOPMENT,751,EXPERIMENT,MEASURED_DATA,SUMMARY,SM_DEVELOPMENT,harvest_maturity_dap,R8AP,"Growth stage days>planting, harv mature",dap,single,10,,,,,,,,,,,,,,,
SM_DEVELOPMENT,752,EXPERIMENT,MEASURED_DATA,SUMMARY,SM_DEVELOPMENT,harvest_mat_dap_stdev,R8APS,Standard deviation of harvest maturity DAP,dap,dap,,,,,,,,,,,,,,,,
SM_DEVELOPMENT,753,EXPERIMENT,MEASURED_DATA,SUMMARY,SM_DEVELOPMENT,tuber_initiation_dap,TDAP,"Growth stage days>planting, tuber init",dap,single,10,,,,,,,,,,,,,,,
SM_DEVELOPMENT,754,EXPERIMENT,MEASURED_DATA,SUMMARY,SM_DEVELOPMENT,growth_stage_apex_1_cm,AP1D,"Growth stage date, apex 1cm",date,date,,,,,,,,,,,,,,,,
SM_DEVELOPMENT,755,EXPERIMENT,MEASURED_DATA,SUMMARY,SM_DEVELOPMENT,growth_stage_branch_1,BR1D,Growth stage date for branch 1,date,date,,,,,,,,,,,,,,,,
SM_DEVELOPMENT,756,EXPERIMENT,MEASURED_DATA,SUMMARY,SM_DEVELOPMENT,growth_stage_branch_2,BR2D,"Growth stage date, branch 2",date,date,,,,,,,,,,,,,,,,
SM_DEVELOPMENT,757,EXPERIMENT,MEASURED_DATA,SUMMARY,SM_DEVELOPMENT,growth_stage_branch_3,BR3D,"Growth stage date, branch 3",date,date,,,,,,,,,,,,,,,,
SM_DEVELOPMENT,758,EXPERIMENT,MEASURED_DATA,SUMMARY,SM_DEVELOPMENT,growth_stage_branch_4,BR4D,"Growth stage date, branch 4",date,date,,,,,,,,,,,,,,,,
SM_DEVELOPMENT,759,EXPERIMENT,MEASURED_DATA,SUMMARY,SM_DEVELOPMENT,silking_date,SKDAT,"Growth stage, silking date",date,single,,,,,,,,,,,,,,,,
SM_DEVELOPMENT,760,EXPERIMENT,MEASURED_DATA,SUMMARY,SM_DEVELOPMENT,double_ridge_date,DRID,"Growth stage date, double ridges",date,date,,,,,,,,,,,,,,,,
SM_DEVELOPMENT,761,EXPERIMENT,MEASURED_DATA,SUMMARY,SM_DEVELOPMENT,ear_emergence_date,EEMD,"Growth stage date, ear emergence",date,date,,,,,,,,,,,,,,,,
SM_DEVELOPMENT,762,EXPERIMENT,MEASURED_DATA,SUMMARY,SM_DEVELOPMENT,forcing_date,FDAT,Forcing date,date,date,,,,,,,,,,,,,,,,
SM_DEVELOPMENT,763,EXPERIMENT,MEASURED_DATA,SUMMARY,SM_DEVELOPMENT,panicle_initiation_date,IDAT,"Growth stage of panicle initiation, as date",date,date,,,,,,,,,,,,,,,,
SM_DEVELOPMENT,764,EXPERIMENT,MEASURED_DATA,SUMMARY,SM_DEVELOPMENT,jointing_date,JDAT,Growth stage of jointing (node detectable through sheath) in cereals,date,date,,,,,,,,,,,,,,,,
SM_DEVELOPMENT,765,EXPERIMENT,MEASURED_DATA,SUMMARY,SM_DEVELOPMENT,leaf_3_full_expansion,LF3D,"Growth stage date, leaf3 full expansion",date,date,,,,,,,,,,,,,,,,
SM_DEVELOPMENT,766,EXPERIMENT,MEASURED_DATA,SUMMARY,SM_DEVELOPMENT,leaf_5_full_expansion,LF5D,"Growth stage date, leaf5 full expansion",date,date,,,,,,,,,,,,,,,,
SM_DEVELOPMENT,767,EXPERIMENT,MEASURED_DATA,SUMMARY,SM_DEVELOPMENT,last_leaf_stage,LLFD,"Growth stage date, last leaf",date,date,,,,,,,,,,,,,,,,
SM_DEVELOPMENT,768,EXPERIMENT,MEASURED_DATA,SUMMARY,SM_DEVELOPMENT,maturity_day_2,MDAT2,Date of physiological maturity using alternate criteria,date,date,,,,,,,,,,,,,,,,
SM_DEVELOPMENT,769,EXPERIMENT,MEASURED_DATA,SUMMARY,SM_DEVELOPMENT,first_pod_set_date,PD1T,"Growth stage of first pod, as date",date,date,,,,,,,,,,,,,,,,
SM_DEVELOPMENT,770,EXPERIMENT,MEASURED_DATA,SUMMARY,SM_DEVELOPMENT,full_size_pod_date,PDFT,"Growth stage of full-sized pod, as date",date,date,,,,,,,,,,,,,,,,
SM_DEVELOPMENT,771,EXPERIMENT,MEASURED_DATA,SUMMARY,SM_DEVELOPMENT,beginning_bloom_stage,R1AT,"Growth stage date, beginning bloom",date,date,,,,,,,,,,,,,,,,
SM_DEVELOPMENT,772,EXPERIMENT,MEASURED_DATA,SUMMARY,SM_DEVELOPMENT,beginning_peg_stage,R2AT,"Growth stage date, beginning peg",date,date,,,,,,,,,,,,,,,,
SM_DEVELOPMENT,773,EXPERIMENT,MEASURED_DATA,SUMMARY,SM_DEVELOPMENT,beginning_pod_stage,R3AT,"Growth stage date, beginning pod",date,date,,,,,,,,,,,,,,,,
SM_DEVELOPMENT,774,EXPERIMENT,MEASURED_DATA,SUMMARY,SM_DEVELOPMENT,full_size_pod_stage,R4AT,"Growth stage date, full-sized pod",date,date,,,,,,,,,,,,,,,,
SM_DEVELOPMENT,775,EXPERIMENT,MEASURED_DATA,SUMMARY,SM_DEVELOPMENT,beginning_seed_stage,R5AT,"Growth stage date, beginning seed",date,date,,,,,,,,,,,,,,,,
SM_DEVELOPMENT,776,EXPERIMENT,MEASURED_DATA,SUMMARY,SM_DEVELOPMENT,full_seed_stage,R6AT,"Growth stage date, full seed",date,date,,,,,,,,,,,,,,,,
SM_DEVELOPMENT,777,EXPERIMENT,MEASURED_DATA,SUMMARY,SM_DEVELOPMENT,beginning_maturity_date,R7AT,"Growth stage date, beginning maturity",date,date,,,,,,,,,,,,,,,,
SM_DEVELOPMENT,778,EXPERIMENT,MEASURED_DATA,SUMMARY,SM_DEVELOPMENT,harvest_maturity_stage,R8AT,"Growth stage date, harvest maturity",date,date,,,,,,,,,,,,,,,,
SM_DEVELOPMENT,779,EXPERIMENT,MEASURED_DATA,SUMMARY,SM_DEVELOPMENT,pod_over-mature_stage,R9AT,"Growth stage date, pod over-mature",date,date,,,,,,,,,,,,,,,,
SM_DEVELOPMENT,781,EXPERIMENT,MEASURED_DATA,SUMMARY,SM_DEVELOPMENT,terminal_spikelet_stage,TSPD,"Growth stage date, terminal spikelet",date,date,,,,,,,,,,,,,,,,
SM_DEVELOPMENT,782,EXPERIMENT,MEASURED_DATA,SUMMARY,SM_DEVELOPMENT,zadoks_21_growth_stage,Z21D,"Growth stage date, Zadoks 21",date,date,,,,,,,,,,,,,,,,
SM_DEVELOPMENT,783,EXPERIMENT,MEASURED_DATA,SUMMARY,SM_DEVELOPMENT,zadoks_30_growth_stage,Z30D,"Growth stage date, Zadoks 30",date,date,,,,,,,,,,,,,,,,
SM_DEVELOPMENT,784,EXPERIMENT,MEASURED_DATA,SUMMARY,SM_DEVELOPMENT,zadoks_31_growth_stage,Z31D,"Growth stage date, Zadoks 31",date,date,,,,,,,,,,,,,,,,
SM_DEVELOPMENT,785,EXPERIMENT,MEASURED_DATA,SUMMARY,SM_DEVELOPMENT,zadoks_37_growth_stage,Z37D,"Growth stage date, Zadoks 37",date,date,,,,,,,,,,,,,,,,
SM_DEVELOPMENT,786,EXPERIMENT,MEASURED_DATA,SUMMARY,SM_DEVELOPMENT,zadoks_39_growth_stage,Z39D,"Growth stage date, Zadoks 39",date,date,,,,,,,,,,,,,,,,
SM_DEVELOPMENT,787,EXPERIMENT,MEASURED_DATA,SUMMARY,SM_DEVELOPMENT,first_square_date,SQDAT,Date of first square on plant,day,single,0,366,,,,,,,,,,,,,,
SM_DEVELOPMENT,788,EXPERIMENT,MEASURED_DATA,SUMMARY,SM_DEVELOPMENT,anthesis_dap_stdev,ADAPS,Standard deviation of anthesis DAP,dap,dap,,,,,,,,,,,,,,,,
SM_DEVELOPMENT,789,EXPERIMENT,MEASURED_DATA,SUMMARY,SM_DEVELOPMENT,phys_mat_dap_stdev,MDAPS,Standard deviation of physiological maturity DAP,dap,dap,,,,,,,,,,,,,,,,
SM_DEVELOPMENT,790,EXPERIMENT,MEASURED_DATA,SUMMARY,SM_DEVELOPMENT,growing_season_duration,GSLEN,Length of time between planting and harvest dates,days,days,,,,,,,,,,,,,,,,
SM_GROWTH,794,EXPERIMENT,MEASURED_DATA,SUMMARY,SM_GROWTH,roots_dry_weight_harvest,RWAH,Roots dry weight at harvest,kg/ha,single,0,,,,,,,,,,,,,,,
SM_GROWTH,795,EXPERIMENT,MEASURED_DATA,SUMMARY,SM_GROWTH,plant_density_emergence,PLPAE,"Plant density (population or stand) at full emergence, equivalent to initial stand count",1/m2,single,,,,,,,,,,,,,,,,
SM_GROWTH,796,EXPERIMENT,MEASURED_DATA,SUMMARY,SM_GROWTH,plant_density_maturity,PLPAM,Plant density (population or stand) at maturity,1/m2,single,0,,,,,,,,,,,,,,,
SM_GROWTH,797,EXPERIMENT,MEASURED_DATA,SUMMARY,SM_GROWTH,plant_density_harvest,PLPAH,Plant density (population or stand) at harvest,1/m2,single,0,,,,,,,,,,,,,,,
SM_GROWTH,799,EXPERIMENT,MEASURED_DATA,SUMMARY,SM_GROWTH,grain_oil_conc_maturity,GL%M,Grain oil concentration at maturity,%,single,0,50,,,,,,,,,,,,,,
SM_GROWTH,800,EXPERIMENT,MEASURED_DATA,SUMMARY,SM_GROWTH,grain_protein_conc_matur,GPR%M,Grain protein concentration at maturity,%,single,0,50,,,,,,,,,,,,,,
SM_GROWTH,801,EXPERIMENT,MEASURED_DATA,SUMMARY,SM_GROWTH,grain_starch_conc_matur,GS%M,Grain starch concentration at maturity,%,single,0,50,,,,,,,,,,,,,,
SM_GROWTH,802,EXPERIMENT,MEASURED_DATA,SUMMARY,SM_GROWTH,grain_gluten_conc_matur,GG%M,Grain gluten concentration at maturity,%,single,,,,,,,,,,,,,,,,
SM_GROWTH,803,EXPERIMENT,MEASURED_DATA,SUMMARY,SM_GROWTH,purity,HPRH,"Purity of sugar, e.g. extract from cane",%,single,0,100,,,,,,,,,,,,,,
SM_GROWTH,804,EXPERIMENT,MEASURED_DATA,SUMMARY,SM_GROWTH,threshing_%_at_maturity,THAM,Threshing % at maturity,%,single,0,100,,,,,,,,,,,,,,
SM_GROWTH,805,EXPERIMENT,MEASURED_DATA,SUMMARY,SM_GROWTH,eye_weight,EWUM,Eye weight at harvest maturity,g/eye,single,0,,,,,,,,,,,,,,,
SM_GROWTH,806,EXPERIMENT,MEASURED_DATA,SUMMARY,SM_GROWTH,lint_weight_maturity,LIWAM,Lint weight at maturity,g/m2,single,0,,,,,,,,,,,,,,,
SM_GROWTH,807,EXPERIMENT,MEASURED_DATA,SUMMARY,SM_GROWTH,lint_fraction_maturity,LIFAM,Lint fraction at maturity,g/g,single,0,100,,,,,,,,,,,,,,
SM_GROWTH,808,EXPERIMENT,MEASURED_DATA,SUMMARY,SM_GROWTH,fiber_length,FILEN,Fiber length,cm,single,0,,,,,,,,,,,,,,,
SM_GROWTH,809,EXPERIMENT,MEASURED_DATA,SUMMARY,SM_GROWTH,fiber_uniformity,FIBUI,"Fiber uniformity index, ratio between the mean length and the upper half mean length of fibers",%,single,0,100,,,,,,,,,,,,,,
SM_GROWTH,810,EXPERIMENT,MEASURED_DATA,SUMMARY,SM_GROWTH,fiber_strength,FISTR,Fiber strength,g/tex,single,0,,,,,,,,,,,,,,,
SM_GROWTH,811,EXPERIMENT,MEASURED_DATA,SUMMARY,SM_GROWTH,fiber_micronaire,FIMIC,"Fiber micronaire, measure of the air permeability of compressed cotton fibers fiber, an indication of fineness and maturity",,single,3,6,,,,,,,,,,,,,,
SM_GROWTH,812,EXPERIMENT,MEASURED_DATA,SUMMARY,SM_GROWTH,fiber_color_grade_Rd,FICRD,"Fiber color grade, HVI Rd reflectance",,single,,,,,,,,,,,,,,,,
SM_GROWTH,813,EXPERIMENT,MEASURED_DATA,SUMMARY,SM_GROWTH,fiber_color_grade_B,FICPB,"Fiber color grade, HVI +B yellowness",,single,,,,,,,,,,,,,,,,
SM_GROWTH,814,EXPERIMENT,MEASURED_DATA,SUMMARY,SM_GROWTH,fiber_HVI_trash,FITRS,Percent of fiber surface area occupied by trash particles,%,single,0,100,,,,,,,,,,,,,,
SM_GROWTH,815,EXPERIMENT,MEASURED_DATA,SUMMARY,SM_GROWTH,fiber_elongation,FIELN,"Fiber elongation, as percent above original length before breakage",%,single,,,,,,,,,,,,,,,,
SM_GROWTH,816,EXPERIMENT,MEASURED_DATA,SUMMARY,SM_GROWTH,harv_yld_grn_fr_pl_mat,GFPM,"Harvest yield (grain, fresh), per plant at maturity",g/,single,0,,,,,,,,,,,,,,,
SM_GROWTH,817,EXPERIMENT,MEASURED_DATA,SUMMARY,SM_GROWTH,grain_dry_wt_matur_plnt,GWPM,"Grain dry wt at maturity, per plant basis",g/,single,0,,,,,,,,,,,,,,,
SM_GROWTH,819,EXPERIMENT,MEASURED_DATA,SUMMARY,SM_GROWTH,byprod_removed_at_matur,BWAM,By-product weight at maturity,kg/ha,single,0,,,,,,,,,,,,,,,
SM_GROWTH,820,EXPERIMENT,MEASURED_DATA,SUMMARY,SM_GROWTH,tops_dead_dry_wt_anthes,CDWA,Tops+dead dry wt at anthesis,kg/ha,single,0,,,,,,,,,,,,,,,
SM_GROWTH,821,EXPERIMENT,MEASURED_DATA,SUMMARY,SM_GROWTH,cane_yield_harv,CFAH,Cane fresh yield at harvest,kg/ha,single,0,,,,,,,,,,,,,,,
SM_GROWTH,822,EXPERIMENT,MEASURED_DATA,SUMMARY,SM_GROWTH,chaff_dry_weight_harvest,CHWA,"Chaff dry weight, harvest",kg/ha,single,0,,,,,,,,,,,,,,,
SM_GROWTH,824,EXPERIMENT,MEASURED_DATA,SUMMARY,SM_GROWTH,tops_dw_mat_stdev,CWAMS,"Standard deviation of tops weight, maturity",kg/ha,kg/ha,,,,,,,,,,,,,,,,
SM_GROWTH,825,EXPERIMENT,MEASURED_DATA,SUMMARY,SM_GROWTH,harv_yld_grn_fresh_matur,GFAM,"Harvest yield (grain, fresh), maturity",kg/ha,single,0,,,,,,,,,,,,,,,
SM_GROWTH,827,EXPERIMENT,MEASURED_DATA,SUMMARY,SM_GROWTH,harv_yield_matur_f_wt,HFAM,Harvest yield at harvest maturity (fresh wt),kg/ha,single,0,,,,,,,,,,,,,,,
SM_GROWTH,828,EXPERIMENT,MEASURED_DATA,SUMMARY,SM_GROWTH,yield_corrected,HWAC,Harvest yield corrected for various factors,kg/ha,single,0,,,,,,,,,,,,,,,
SM_GROWTH,829,EXPERIMENT,MEASURED_DATA,SUMMARY,SM_GROWTH,leaf_dry_wt_at_maturity,LWAM,Leaf dry weight at harvest maturity,kg/ha,single,0,,,,,,,,,,,,,,,
SM_GROWTH,832,EXPERIMENT,MEASURED_DATA,SUMMARY,SM_GROWTH,tot_dry_weight_maturity,TWAM,Total dry weight at maturity,kg/ha,single,0,,,,,,,,,,,,,,,
SM_GROWTH,834,EXPERIMENT,MEASURED_DATA,SUMMARY,SM_GROWTH,vegetative_dry_wt_matur,VWAM,"Veg (leaf+stem) dry wt, maturity",kg/ha,single,0,,,,,,,,,,,,,,,
SM_GROWTH,835,EXPERIMENT,MEASURED_DATA,SUMMARY,SM_GROWTH,test_wt_fresh_maturity,GYFVM,Test weight (fresh) at maturity,kg/l,single,0,,,,,,,,,,,,,,,
SM_GROWTH,836,EXPERIMENT,MEASURED_DATA,SUMMARY,SM_GROWTH,grain_ethanol_yield,GETM,Ethanol yield of grain,l/kg,single,0,50,,,,,,,,,,,,,,
SM_GROWTH,838,EXPERIMENT,MEASURED_DATA,SUMMARY,SM_GROWTH,canopy_height_maturity,CHTM,Canopy height at physiological maturity,m,single,0,5,,,,,,,,,,,,,,
SM_GROWTH,839,EXPERIMENT,MEASURED_DATA,SUMMARY,SM_GROWTH,canopy_height_harvest,CHTH,Canopy height at harvest,m,single,0,5,,,,,,,,,,,,,,
SM_GROWTH,840,EXPERIMENT,MEASURED_DATA,SUMMARY,SM_GROWTH,canopy_height_max,CHTX,"Canopy height, max value",m,single,0,5,,,,,,,,,,,,,,
SM_GROWTH,841,EXPERIMENT,MEASURED_DATA,SUMMARY,SM_GROWTH,canopy_ht_max_stdev,CHTXS,"Canopy height, std dev of max value",m,single,,,,,,,,,,,,,,,,
SM_GROWTH,842,EXPERIMENT,MEASURED_DATA,SUMMARY,SM_GROWTH,plant_height_anthesis,PHTA,"Plant height (e.g., including spikes above canopy per se) at anthesis",m,single,,,,,,,,,,,,,,,,
SM_GROWTH,843,EXPERIMENT,MEASURED_DATA,SUMMARY,SM_GROWTH,plant_height_max,PHTX,"Plant height (e.g., including spikes above canopy per se), maximum value in season",m,single,,,,,,,,,,,,,,,,
SM_GROWTH,844,EXPERIMENT,MEASURED_DATA,SUMMARY,SM_GROWTH,plant_height_maturity,PHTM,"Plant height (e.g., including spikes above canopy per se) at maturity",m,single,,,,,,,,,,,,,,,,
SM_GROWTH,845,EXPERIMENT,MEASURED_DATA,SUMMARY,SM_GROWTH,ear_height_max,EHTX,"Ear height, max value",m,single,0,5,,,,,,,,,,,,,,
SM_GROWTH,846,EXPERIMENT,MEASURED_DATA,SUMMARY,SM_GROWTH,ear_ht_max_stdev,EHTXS,"Ear height, std dev of max value",m,single,,,,,,,,,,,,,,,,
