template_section,var_uid,icasa_dataset,icasa_subset,icasa_group,icasa_subgroup,icasa_header_long,icasa_header_short,icasa_description,icasa_unit,icasa_type,icasa_minval,icasa_maxval,data_model,section,header,synonyms,header_long,DQ_mindat,description,unit,code_mappings,fun_header,fun_header_args,fun_values,fun_values_args,comments
EXP_METADATA,2,EXPERIMENT,METADATA,GENERAL,,name_of_experiment,EXNAME,Name of experiment,text,text,1,,bonares-lte_de,METADATA,Experiment_name,,,,,,,,,,,
EXP_METADATA,6,EXPERIMENT,METADATA,GENERAL,,experiment_narrative,EXP_NARR,"General description of experiment. Can include noteworthy events, findings, etc.",,memo,,,bonares-lte_de,METADATA,METADATA.Abstract,,,,,,,,,,,
EXP_METADATA,38,EXPERIMENT,METADATA,PERSONS,,e_mail_address,EX_EMAIL,E-mail address of researcher,,text,,,bonares-lte_de,METADATA,METADATA.Contact_email,,,,,,,,,,,
EXP_METADATA,32,EXPERIMENT,METADATA,PERSONS,,researcher_last_name,LAST_NAME,Last name of researchers involved with the experiment(s) or data,,text,,,bonares-lte_de,METADATA,METADATA.Contact_persons,,,,,,,,,,,
EXP_METADATA,33,EXPERIMENT,METADATA,PERSONS,,researcher_first_name,FIRST_NAME,First name of researchers involved with the experiment(s) or data,,text,,,bonares-lte_de,METADATA,METADATA.Contact_persons,,,,,,,,,,,
EXP_METADATA,34,EXPERIMENT,METADATA,PERSONS,,researcher_name_mi,MID_INITIAL,Middle initial of researchers involved with the experiment(s) or data,,text,,,bonares-lte_de,METADATA,METADATA.Contact_persons,,,,,,,,,,,
EXP_METADATA,27,EXPERIMENT,METADATA,GENERAL,,revision_date_first,REV_DATE_FIRST,Date the file was first created,date,date,,,bonares-lte_de,METADATA,METADATA.Date_published,,,,,,,,,,,
EXP_METADATA,28,EXPERIMENT,METADATA,GENERAL,,revision_date_latest,REV_DATE_LATEST,Date the file was last revised,date,date,,,bonares-lte_de,METADATA,METADATA.Date_revised,,,,,,,,,,,
EXP_METADATA,47,EXPERIMENT,METADATA,DOCUMENTS,,digital_object_id,DIGITAL_OBJ_ID,Digital_object_identifier according to international standard (DOI),,memo,,,bonares-lte_de,METADATA,METADATA.Experiment_doi,,,,,,,,,,,Not in BonaRes data model; extracted from xml metadata
EXP_METADATA,25,EXPERIMENT,METADATA,GENERAL,,ex_funding_source,EX_FUNDING_SOURCE,Funding source(s) for this data set,,memo,,,bonares-lte_de,METADATA,METADATA.Funding,,,,,,,,,,,
EXP_METADATA,41,EXPERIMENT,METADATA,INSTITUTIONS,,institute_name,INSTITUTION,Names of participating institutions,,text,,,bonares-lte_de,METADATA,METADATA.Institutions,,,,,,,,,,,
EXP_METADATA,23,EXPERIMENT,METADATA,GENERAL,,ex_license,EX_LICENSE,Data license name and url,text,memo,,,bonares-lte_de,METADATA,METADATA.Legal_constrainsts,,,,,,,,,,,
EXP_METADATA,24,EXPERIMENT,METADATA,GENERAL,,distrib_restrictions,EX_DISTRIB,Distribution limitations for the data set,,memo,,,bonares-lte_de,METADATA,METADATA.Legal_constrainsts,,,,,,,,,,,
WEATHER_DAILY,694,WEATHER,WEATHER_STATION,WEATHER_DAILY,,weather_date,W_DATE,"Date for daily weather, field observations, etc.",date,date,,,bonares-lte_en,METEOROLOGY,METEOROLOGY.Date,,,,Date,date,,,,,,
WEATHER_DAILY,700,WEATHER,WEATHER_STATION,WEATHER_DAILY,,precipitation,RAIN,"Rainfall, including moisture in snow, in one day",mm,single,,,bonares-lte_en,METEOROLOGY,METEOROLOGY.Prec_Sum,,,,Sum of precipitation per day (in mm),mm,,,,,,
WEATHER_DAILY,721,WEATHER,WEATHER_STATION,WEATHER_DAILY,,temp_average_daily,TAVD,"Temperature of air, average daily",degree_C,single,,,bonares-lte_en,METEOROLOGY,METEOROLOGY.Temp_aver_2m,,,,Average daily temperature on ground level (5cm),degree_C,,,,,,
WEATHER_DAILY,717,WEATHER,WEATHER_STATION,WEATHER_DAILY,,flag_for_weather_data,FLAGW,Flag to identify daily weather data with specific problems or significance,code,text,,,bonares-lte_en,METEOROLOGY,REMARK.Content,,,,,,,,,,,
,932,EXPERIMENT,MEASURED_DATA,TIME_SERIES,,obs_time_series_comment,OTS_COMMENT,Additional information regarding a single day's measurements,t/ha,text,,,bonares-lte_de,PFLANZENLABORWERTE,BEMERKUNGEN.Bemerkungen,,,,,,,,,,,
,,,,,,,,,,,,,bonares-lte_de,PFLANZENLABORWERTE,PFLANZENLABORWERTE.C,,,,C in dry matter corn,%,,,,,,TODO: conditial mapping to SUMMARY var IF date = harvest date?
,993,EXPERIMENT,MEASURED_DATA,TIME_SERIES,PLANT_GROWTH,harvest_yield_at_day_dw,HWAD,"Harvest yield, specified day (dry wt)",kg/ha,single,0,,bonares-lte_de,PFLANZENLABORWERTE,PFLANZENLABORWERTE.Hp_Trockenmasse,,,,"Dry matter of the harvested main product, e.g. grains",dt/ha,,,,,,
,,,,,,,,,,,,,bonares-lte_de,PFLANZENLABORWERTE,PFLANZENLABORWERTE.K,,,,K in dry matter corn,%,,,,,,"TODO: calculate grain_potassium_content based on yield 'function(yield, x) {  yield * (x / 100) }'; figure out how to specify"
,1079,EXPERIMENT,MEASURED_DATA,TIME_SERIES,PLANT_NITROGEN,grain_N_conc,GN%D,Grain N concentration on sampling date,%,single,0,,bonares-lte_de,PFLANZENLABORWERTE,PFLANZENLABORWERTE.N,,,,N in dry matter corn,%,,,,,,TODO: also generate content (kg/ha); Note: ICASA concentration basis (dry/fresh weight) not specified
,,,,,,,,,,,,,bonares-lte_de,PFLANZENLABORWERTE,PFLANZENLABORWERTE.N_Proz_Restpflanze_ohne_Korn,,,,N in dry matter plant above earth (without corn),%,,,,,,Question: does top includes grain?
,939,EXPERIMENT,MEASURED_DATA,TIME_SERIES,PLANT_GROWTH,grain_oil_conc,GL%D,Grain oil concentration,%,single,0,,bonares-lte_de,PFLANZENLABORWERTE,PFLANZENLABORWERTE.Oel,,,,Oel content from fresh corn,%,,,,,,Note: ICASA concentration basis (dry/fresh weight) not specified
,1124,EXPERIMENT,MEASURED_DATA,TIME_SERIES,PLANT_PHOSPHORUS,grain_P_conc,GP%D,Grain phosphorus concentration,%,single,0,,bonares-lte_de,PFLANZENLABORWERTE,PFLANZENLABORWERTE.P,,,,P in dry matter corn,%,,,,,,TODO: also generate content (kg/ha); Note: ICASA concentration basis (dry/fresh weight) not specified
,1080,EXPERIMENT,MEASURED_DATA,TIME_SERIES,PLANT_NITROGEN,grain_protein_concentration,GPR%D,Grain protein concentration,%,single,0,,bonares-lte_de,PFLANZENLABORWERTE,PFLANZENLABORWERTE.Protein,,,,Protein content from fresh corn,%,,,,,,Note: ICASA concentration basis (dry/fresh weight) not specified
,927,EXPERIMENT,MEASURED_DATA,TIME_SERIES,,date_of_measurement,DATE,Date of measurement,date,single,0,,bonares-lte_de,PFLANZENLABORWERTE,PROBENAHME_PFLANZEN.Termin,,,,,,,,,,,
,420,EXPERIMENT,MANAGEMENT,CHEMICALS,CHEMICAL_APPLICS,chemical_applic_comment,CHA_COMMENT,Additional information on a single application of agrochemicals,text,text,,,bonares-lte_de,PFLANZENSCHUTZ,BEMERKUNGEN.Bemerkungen,,,,,,,,,,,
CHEMICALS,409,EXPERIMENT,MANAGEMENT,CHEMICALS,,chemical_applic_name,CH_NAME,"Chemical, name experimentalist assigned to a given application level",text,text,,,bonares-lte_de,PFLANZENSCHUTZ,PERSON.Nachname,,,,,,,,,,,
CHEMICALS,409,EXPERIMENT,MANAGEMENT,CHEMICALS,,chemical_applic_name,CH_NAME,"Chemical, name experimentalist assigned to a given application level",text,text,,,bonares-lte_de,PFLANZENSCHUTZ,PERSON.Vorname,,,,,,,,,,,
CHEMICAL_APPLICS,418,EXPERIMENT,MANAGEMENT,CHEMICALS,CHEMICAL_APPLICS,chemical_applic_amount,CHAMT,Chemicals application amount (active),kg/ha,single,0,,bonares-lte_de,PFLANZENSCHUTZ,PFLANZENSCHUTZ.Menge,,,,Amount of applied plant protection. The unit differs according to the used product.,kg/ha,,,,,,kg/ha by default
CHEMICAL_APPLICS,418,EXPERIMENT,MANAGEMENT,CHEMICALS,CHEMICAL_APPLICS,chemical_applic_amount,CHAMT,Chemicals application amount (active),kg/ha,single,0,,bonares-lte_de,PFLANZENSCHUTZ,PFLANZENSCHUTZ.Menge_kg_ha,,,,Amount of applied plant protection. The unit differs according to the used product.,kg/ha,,,,,,
CHEMICAL_APPLICS,418,EXPERIMENT,MANAGEMENT,CHEMICALS,CHEMICAL_APPLICS,chemical_applic_amount,CHAMT,Chemicals application amount (active),l/ha,single,0,,bonares-lte_de,PFLANZENSCHUTZ,PFLANZENSCHUTZ.Menge_l_ha,,,,Amount of applied plant protection. The unit differs according to the used product.,l/ha,,,,,,Note: incorret unit; need addition to ICASA for non-solid formulations
CHEMICALS,409,EXPERIMENT,MANAGEMENT,CHEMICALS,,chemical_applic_name,CH_NAME,"Chemical, name experimentalist assigned to a given application level",text,text,,,bonares-lte_de,PFLANZENSCHUTZ,PFLANZENSCHUTZ.Person_Nachname,PERSON.Nachname,,,,,,,,,,
CHEMICALS,409,EXPERIMENT,MANAGEMENT,CHEMICALS,,chemical_applic_name,CH_NAME,"Chemical, name experimentalist assigned to a given application level",text,text,,,bonares-lte_de,PFLANZENSCHUTZ,PFLANZENSCHUTZ.Person_Vorname,PERSON.Vorname,,,,,,,,,,
CHEMICAL_APPLICS,415,EXPERIMENT,MANAGEMENT,CHEMICALS,CHEMICAL_APPLICS,chemical_applic_material,CHCD,Chemicals application material,code,text,,,bonares-lte_de,PFLANZENSCHUTZ,PFLANZENSCHUTZ.Pflanzenschutzmittel_Name,PFLANZENSCHUTZ_MITTEL.Name,,,,,,,,,,Name and active ingredient not clearly distinct: suggest dictionary change
CHEMICAL_APPLICS,415,EXPERIMENT,MANAGEMENT,CHEMICALS,CHEMICAL_APPLICS,chemical_applic_material,CHCD,Chemicals application material,code,text,,,bonares-lte_de,PFLANZENSCHUTZ,PFLANZENSCHUTZ.Pflanzenschutzmittel_Wirkstoff,PFLANZENSCHUTZ_MITTEL.Wirkstoff,,,,,,,,,,Name and active ingredient not clearly distinct: suggest dictionary change
CHEMICAL_APPLICS,411,EXPERIMENT,MANAGEMENT,CHEMICALS,CHEMICAL_APPLICS,chemical_applic_date,CDATE,Chemicals application date,date,date,,,bonares-lte_de,PFLANZENSCHUTZ,PFLANZENSCHUTZ.Termin,,,,Date of plant protection measure,date,,,,,,
CHEMICALS,408,EXPERIMENT,MANAGEMENT,CHEMICALS,,chemical_applic_level,CH,Chemicals application level,number,single,0,,bonares-lte_de,PFLANZENSCHUTZ,Pflanzenschutz_ID,,,,,,,,,,,
CHEMICAL_APPLICS,415,EXPERIMENT,MANAGEMENT,CHEMICALS,CHEMICAL_APPLICS,chemical_applic_material,CHCD,Chemicals application material,code,text,,,bonares-lte_de,PFLANZENSCHUTZ,PFLANZENSCHUTZ_MITTEL.Name,,,,,,,,,,,
CHEMICAL_APPLICS,415,EXPERIMENT,MANAGEMENT,CHEMICALS,CHEMICAL_APPLICS,chemical_applic_material,CHCD,Chemicals application material,code,text,,,bonares-lte_de,PFLANZENSCHUTZ,PFLANZENSCHUTZ_MITTEL.Wirkstoff,,,,Active substance in the plant protection product,text,,,,,,
CHEMICAL_APPLICS,416,EXPERIMENT,MANAGEMENT,CHEMICALS,CHEMICAL_APPLICS,chemical_applic_method,CHACD,Chemicals application method,code,text,,,bonares-lte_de,PFLANZENSCHUTZ,TECHNIK.Technik,,,,Name of the machine/agricultural engineering,text,,,,,,
,927,EXPERIMENT,MEASURED_DATA,TIME_SERIES,,date_of_measurement,DATE,Date of measurement,date,single,0,,bonares-lte_en,PLANT_LAB,PLANT_SAMPLING.Date,,,,,,,,,,,
,932,EXPERIMENT,MEASURED_DATA,TIME_SERIES,,obs_time_series_comment,OTS_COMMENT,Additional information regarding a single day's measurements,t/ha,text,,,bonares-lte_en,PLANT_LAB,REMARK.Content,,,,,,,,,,,
CHEMICAL_APPLICS,416,EXPERIMENT,MANAGEMENT,CHEMICALS,CHEMICAL_APPLICS,chemical_applic_method,CHACD,Chemicals application method,code,text,,,bonares-lte_en,PLANT_PROTECTION,AGRICULTURAL_ENGINEERING.Name,,,,Name of the machine/agricultural engineering,text,,,,,,
CHEMICAL_APPLICS,411,EXPERIMENT,MANAGEMENT,CHEMICALS,CHEMICAL_APPLICS,chemical_applic_date,CDATE,Chemicals application date,date,date,,,bonares-lte_en,PLANT_PROTECTION,PLANT_PROTECTION.Date,,,,,,,,,,,
CHEMICAL_APPLICS,418,EXPERIMENT,MANAGEMENT,CHEMICALS,CHEMICAL_APPLICS,chemical_applic_amount,CHAMT,Chemicals application amount (active),kg/ha,single,0,,bonares-lte_en,PLANT_PROTECTION,PLANT_PROTECTION.Quantity_Liquid,,,,,,,,,,,
CHEMICAL_APPLICS,415,EXPERIMENT,MANAGEMENT,CHEMICALS,CHEMICAL_APPLICS,chemical_applic_material,CHCD,Chemicals application material,code,text,,,bonares-lte_en,PLANT_PROTECTION,PLANT_PROTECTION_PRODUCT.Active_Substance,,,,,,,,,,,Name and active ingredient not clearly distinct: suggest dictionary change
CHEMICAL_APPLICS,415,EXPERIMENT,MANAGEMENT,CHEMICALS,CHEMICAL_APPLICS,chemical_applic_material,CHCD,Chemicals application material,code,text,,,bonares-lte_en,PLANT_PROTECTION,PLANT_PROTECTION_PRODUCT.Name,,,,,,,,,,,Name and active ingredient not clearly distinct: suggest dictionary change
CHEMICAL_APPLICS,415,EXPERIMENT,MANAGEMENT,CHEMICALS,CHEMICAL_APPLICS,chemical_applic_material,CHCD,Chemicals application material,code,text,,,bonares-lte_en,PLANT_PROTECTION,PLANT_PROTECTION_PRODUCT.Name_EN,,,,,,,,,,,
CHEMICAL_APPLICS,420,EXPERIMENT,MANAGEMENT,CHEMICALS,CHEMICAL_APPLICS,chemical_applic_comment,CHA_COMMENT,Additional information on a single application of agrochemicals,text,memo,,,bonares-lte_en,PLANT_PROTECTION,REMARK.Content,,,,,,,,,,,
CHEMICAL_APPLICS,420,EXPERIMENT,MANAGEMENT,CHEMICALS,CHEMICAL_APPLICS,chemical_applic_comment,CHA_COMMENT,Additional information on a single application of agrochemicals,text,memo,,,bonares-lte_en,PLANT_PROTECTION,REMARK.Content_EN,,,,,,,,,,,
PLANTINGS,270,EXPERIMENT,MANAGEMENT,PLANTINGS,,emergence_date,EDATE,Date of emergence,date,date,,,dssat,PLANTING_DETAILS,EDATE,,,0,Emergence date (earliest treatment),date,,,,,,
PLANTINGS,262,EXPERIMENT,MANAGEMENT,PLANTINGS,,planting_level,PL,"Planting, level in treatment structure",1,single,,,dssat,PLANTING_DETAILS,P,,,0,Planting level,1,,,,,,
PLANTINGS,283,EXPERIMENT,MANAGEMENT,PLANTINGS,,transplant_age,PAGE,Transplant age,day,single,0,366,dssat,PLANTING_DETAILS,PAGE,,,0,Transplant age,day,,,,,,
PLANTINGS,263,EXPERIMENT,MANAGEMENT,PLANTINGS,,planting_date,PDATE,Planting or sowing date,date,date,,,dssat,PLANTING_DETAILS,PDATE,,,2,Planting date,date,,,,,,
PLANTINGS,285,EXPERIMENT,MANAGEMENT,PLANTINGS,,nursery_env_pl_material,PLENV,Transplant nursery environment (mean temperature),degree_C,single,,,dssat,PLANTING_DETAILS,PENV,,,0,Transplant environment,degree_C,,,,,,
PLANTINGS,281,EXPERIMENT,MANAGEMENT,PLANTINGS,,planting_depth,PLDP,Depth of seed (or other planted material) relative to soil surface.,mm,single,,,dssat,PLANTING_DETAILS,PLDP,,,0,Planting depth,cm,,,,,,icasa and dssat unit mismatch
PLANTINGS,276,EXPERIMENT,MANAGEMENT,PLANTINGS,,planting_distribution,PLDS,Planting distribution,code,text,,,dssat,PLANTING_DETAILS,PLDS,,,0,"Planting distribution, row R, broadcast B, hill H",code,"list('c(R, H, U): 1')",,,,,
PLANTINGS,274,EXPERIMENT,MANAGEMENT,PLANTINGS,,planting_material,PLMA,Planting material,code,text,,,dssat,PLANTING_DETAILS,PLME,,,0,Planting method,code,1,,,,,B (Bedded) not in ICASA key
PLANTINGS,265,EXPERIMENT,MANAGEMENT,PLANTINGS,,planting_level_name,PL_NAME,"Planting level, name of treatment",text,text,,,dssat,PLANTING_DETAILS,PLNAME,,,0,Planting details level name,text,,,,,,
PLANTINGS,280,EXPERIMENT,MANAGEMENT,PLANTINGS,,plants_per_hill,PLPH,Plants per hill,1,single,,,dssat,PLANTING_DETAILS,PLPH,,,0,Plants per hill (if appropriate),1,,,,,,
PLANTINGS,279,EXPERIMENT,MANAGEMENT,PLANTINGS,,row_direction,PLRD,"Row direction, degrees from N",arc_degrees,single,0,359,dssat,PLANTING_DETAILS,PLRD,,,0,"Row direction, degrees from N",arc_degrees,,,,,,
PLANTINGS,277,EXPERIMENT,MANAGEMENT,PLANTINGS,,row_spacing,PLRS,Distance between two adjacent rows,cm,single,0,,dssat,PLANTING_DETAILS,PLRS,,,0,Row spacing,cm,,,,,,
PLANTINGS,278,EXPERIMENT,MANAGEMENT,PLANTINGS,,plant_spacing,PLSP,Spacing of plants in a row,cm,single,0,,dssat,PLANTING_DETAILS,PLSP,,,0,Plot spacing,cm,,,,,,also in plot details
PLANTINGS,282,EXPERIMENT,MANAGEMENT,PLANTINGS,,planting_material_weight,PLMWT,Planting material weight,kg/ha,single,0,,dssat,PLANTING_DETAILS,PLWT,,,0,Planting material dry weight,kg/ha,,,,,,
PLANTINGS,273,EXPERIMENT,MANAGEMENT,PLANTINGS,,plant_pop_at_emergence,PLPOE,Plant population at emergence,1/m2,single,0,,dssat,PLANTING_DETAILS,PPOE,,,1,Plant population at emergence,1/m2,,,,,,
PLANTINGS,272,EXPERIMENT,MANAGEMENT,PLANTINGS,,plant_pop_at_planting,PLPOP,Plant population at planting,1/m2,single,0,,dssat,PLANTING_DETAILS,PPOP,,,2,Plant population at seeding,1/m2,,,,,,
PLANTINGS,286,EXPERIMENT,MANAGEMENT,PLANTINGS,,length_sprout_material,PLSPL,Planting material sprout length,cm,single,0,,dssat,PLANTING_DETAILS,SPRL,,,0,Initial sprout length,cm,,,,,,
ORGANIC_MATERIALS,367,EXPERIMENT,MANAGEMENT,ORGANIC_MATERIALS,,org_materials_applic_lev,OM,Organic materials application level,1,single,,,dssat,RESIDUES,R,,,0,Organic materials application level,1,,,,,,
ORGANIC_MATERIAL_APPLICS,371,EXPERIMENT,MANAGEMENT,ORGANIC_MATERIALS,ORGANIC_MATERIAL_APPLICS,org_materials_applic_lev,OM,"Organic materials application level, links to OM table",1,single,,,dssat,RESIDUES,R,,,0,Organic materials application level,1,,,,,,
ORGANIC_MATERIAL_APPLICS,379,EXPERIMENT,MANAGEMENT,ORGANIC_MATERIALS,ORGANIC_MATERIAL_APPLICS,org_material_applic_amnt,OMAMT,"Organic materials application amount, dry weight basis",kg/ha,single,0,,dssat,RESIDUES,RAMT,,,2,Residue amount,kg/ha,,,,,,check if dw or fw?
ORGANIC_MATERIAL_APPLICS,375,EXPERIMENT,MANAGEMENT,ORGANIC_MATERIALS,ORGANIC_MATERIAL_APPLICS,organic_material,OMCD,"Organic material, identifying code",code,text,,,dssat,RESIDUES,RCOD,,,2,Residue material,code,1,,,,,
ORGANIC_MATERIAL_APPLICS,372,EXPERIMENT,MANAGEMENT,ORGANIC_MATERIALS,ORGANIC_MATERIAL_APPLICS,org_material_applic_date,OMDAT,Organic materials application date,date,date,,,dssat,RESIDUES,RDATE,,,2,Residue incorporation date,date,,,,,,
ORGANIC_MATERIAL_APPLICS,377,EXPERIMENT,MANAGEMENT,ORGANIC_MATERIALS,ORGANIC_MATERIAL_APPLICS,org_material_appl_depth,OMDEP,Organic materials application depth,cm,single,0,,dssat,RESIDUES,RDEP,,,0,Residue incorporation depth,cm,,,,,,
ORGANIC_MATERIALS,368,EXPERIMENT,MANAGEMENT,ORGANIC_MATERIALS,,org_material_applic_name,OM_NAME,Organic materials application name,text,text,,,dssat,RESIDUES,RENAME,,,0,Residue incorporation level name,text,,,,,,
ORGANIC_MATERIAL_APPLICS,386,EXPERIMENT,MANAGEMENT,ORGANIC_MATERIALS,ORGANIC_MATERIAL_APPLICS,organic_material_K_conc,OMK%,Organic materials potasium concentration,%,single,0,,dssat,RESIDUES,RESK,,,0,Residue potassium concentration,%,,,,,,
ORGANIC_MATERIAL_APPLICS,384,EXPERIMENT,MANAGEMENT,ORGANIC_MATERIALS,ORGANIC_MATERIAL_APPLICS,organic_material_N_conc,OMN%,Organic materials nitrogen concentration,%,single,0,,dssat,RESIDUES,RESN,,,1,Residue nitrogen concentration,%,,,,,,also OMN%/OMNPC in ICASA?
ORGANIC_MATERIAL_APPLICS,385,EXPERIMENT,MANAGEMENT,ORGANIC_MATERIALS,ORGANIC_MATERIAL_APPLICS,organic_material_P_conc,OMP%,Organic materials phosphorus concentration,%,single,0,,dssat,RESIDUES,RESP,,,0,Residue phosphorus concentration,%,,,,,,
ORGANIC_MATERIAL_APPLICS,378,EXPERIMENT,MANAGEMENT,ORGANIC_MATERIALS,ORGANIC_MATERIAL_APPLICS,org_material_incorp_perc,OMINP,"Organic materials application, fraction incorporporated as %",%,single,0,100,dssat,RESIDUES,RINP,,,0,Residue incorporation percentage,%,,,,,,
ORGANIC_MATERIAL_APPLICS,376,EXPERIMENT,MANAGEMENT,ORGANIC_MATERIALS,ORGANIC_MATERIAL_APPLICS,org_material_applic_meth,OMACD,Organic materials application method,code,text,,,dssat,RESIDUES,RMET,,,0,Residue incorporation method,code,"list('c(AP001, AP002, AP003, AP004, AP005, AP006, AP007, AP008, AP009, AP011, AP012, AP013, AP014, AP015, AP016, AP017, AP018, AP019, AP020): 1')",,,,,
SIMULATION_CONTROLS,482,EXPERIMENT,MANAGEMENT,SIMULATION_CONTROLS,,simulation_end_date,ENDAT,Simulation end date,date,date,,,dssat,SIMULATION_CONTROLS,ENDAT,,,0,Simulation end date,date,,,,,,
SIMULATION_CONTROLS,481,EXPERIMENT,MANAGEMENT,SIMULATION_CONTROLS,,simulation_start_date,SDAT,Simulation start date,date,date,,,dssat,SIMULATION_CONTROLS,SDATE,,,0,Simulation start date,date,,,,,,
SOIL_ANALYSES,184,EXPERIMENT,MANAGEMENT,SOIL_ANALYSES,,soil_analysis_level,SA,"Soil analysis, treatment level identifier",1,single,,,dssat,SOIL_ANALYSIS,A,,,0,Soil analysis level,1,,,,,,header
SOIL_ANALYSES_LAYERS,200,EXPERIMENT,MANAGEMENT,SOIL_ANALYSES,SOIL_ANALYSES_LAYERS,soil_analysis_level,SA,"Soil analysis, treatment level identifier linkage",1,single,,,dssat,SOIL_ANALYSIS,A,,,0,Soil analysis level,1,,,,,,
SOIL_ANALYSES_LAYERS,202,EXPERIMENT,MANAGEMENT,SOIL_ANALYSES,SOIL_ANALYSES_LAYERS,soil_analysis_layer_base_depth,SABL,Soil layer depth to lower boundary of sample (bottom),cm,single,1,500,dssat,SOIL_ANALYSIS,SABL,,,0,"Depth, base of layer",cm,,,,,,
SOIL_ANALYSES,183,EXPERIMENT,MANAGEMENT,SOIL_ANALYSES,,soil_analysis_date,SADAT,Soil analysis date,date,date,,,dssat,SOIL_ANALYSIS,SADAT,,,0,Analysis date,date,,,,,,header
SOIL_ANALYSES_LAYERS,203,EXPERIMENT,MANAGEMENT,SOIL_ANALYSES,SOIL_ANALYSES_LAYERS,soil_bulk_dens_moist,SABDM,"Soil bulk density, moist, determined on field sample",g/cm3,single,0,,dssat,SOIL_ANALYSIS,SADM,,,0,"Bulk density, moist",g/cm3,,,,,,
SOIL_ANALYSES_LAYERS,210,EXPERIMENT,MANAGEMENT,SOIL_ANALYSES,SOIL_ANALYSES_LAYERS,potassium_exchangeable,SAKE,"Potassium, exchangeable",cmol/kg,single,0,,dssat,SOIL_ANALYSIS,SAKE,,,0,"Potassium, exchangeable",cmol/kg,,,,,,
SOIL_ANALYSES,185,EXPERIMENT,MANAGEMENT,SOIL_ANALYSES,,soil_analysis_name,SA_NAME,Soil analysis name,text,text,,,dssat,SOIL_ANALYSIS,SANAME,,,0,Soil analysis name,text,,,,,,header
SOIL_ANALYSES_LAYERS,206,EXPERIMENT,MANAGEMENT,SOIL_ANALYSES,SOIL_ANALYSES_LAYERS,soil_N_conc_total,SANI,"Nitrogen, total soil, total",%,single,0,,dssat,SOIL_ANALYSIS,SANI,,,0,Total nitrogen,%,,,,,,
SOIL_ANALYSES_LAYERS,204,EXPERIMENT,MANAGEMENT,SOIL_ANALYSES,SOIL_ANALYSES_LAYERS,organic_carbon_conc,SAOC,Organic carbon expressed as g[C]/100 g[soil],%,single,0,,dssat,SOIL_ANALYSIS,SAOC,,,0,Organic carbon,%,,,,,,
SOIL_ANALYSES_LAYERS,208,EXPERIMENT,MANAGEMENT,SOIL_ANALYSES,SOIL_ANALYSES_LAYERS,pH_in_buffer,SAPHB,"pH of soil measured in buffer solution, from in-field sample",1,single,,,dssat,SOIL_ANALYSIS,SAPHB,,,0,pH in buffer,1,,,,,,
SOIL_ANALYSES_LAYERS,207,EXPERIMENT,MANAGEMENT,SOIL_ANALYSES,SOIL_ANALYSES_LAYERS,pH_in_water,SAPHW,"pH of soil in water, from in-field sample",1,single,,,dssat,SOIL_ANALYSIS,SAPHW,,,0,pH in water,1,,,,,,
SOIL_ANALYSES_LAYERS,209,EXPERIMENT,MANAGEMENT,SOIL_ANALYSES,SOIL_ANALYSES_LAYERS,phosphorus_extractable,SAPX,"Phosphorus, extractable",mg/kg,single,0,,dssat,SOIL_ANALYSIS,SAPX,,,0,"Phosphorus, extractable",mg/kg,,,,,,
SOIL_ANALYSES_LAYERS,205,EXPERIMENT,MANAGEMENT,SOIL_ANALYSES,SOIL_ANALYSES_LAYERS,soil_stable_C,SASC,Stable organic carbon by layer expressed as g[C]/100g[soil],%,single,,,dssat,SOIL_ANALYSIS,SASC,,,1,Measured stable organic carbon,%,,,,,,
SOIL_ANALYSES,189,EXPERIMENT,MANAGEMENT,SOIL_ANALYSES,,soil_analys_meth_pH_buff,SAMHB,Soil anlysis method for pH in buffer solution,code,text,,,dssat,SOIL_ANALYSIS,SMHB,,,0,pH in buffer determination method,code,1,,,,,header; no codes reported in DSSAT48 key
SOIL_ANALYSES,191,EXPERIMENT,MANAGEMENT,SOIL_ANALYSES,,soil_anal_meth_exch_K,SAMKE,Soil analysis method for exchangeable K,code,text,,,dssat,SOIL_ANALYSIS,SMKE,,,0,Potassium determination method,code,"list('c(SA001, SA002, SA003, SA004, SA005, SA006, SA007, SA008, SA009, SA010, SA011, SA012, SA013, SA014, SA015): 1')",,,,,header
SOIL_ANALYSES,190,EXPERIMENT,MANAGEMENT,SOIL_ANALYSES,,soil_anal_meth_P_extract,SAMPX,Soil analysis method for P extraction,code,text,,,dssat,SOIL_ANALYSIS,SMPX,,,0,Phosphorus determination method,code,"list('c(SA001, SA002, SA003, SA004, SA005, SA006, SA007, SA008, SA009, SA010, SA011, SA012, SA013, SA014, SA015): 1')",,,,,header
,932,EXPERIMENT,MEASURED_DATA,TIME_SERIES,,obs_time_series_comment,OTS_COMMENT,Additional information regarding a single day's measurements,t/ha,text,,,bonares-lte_en,SOIL_LAB,REMARK.Content,,,,,,,,,,,
,927,EXPERIMENT,MEASURED_DATA,TIME_SERIES,,date_of_measurement,DATE,Date of measurement,date,single,0,,bonares-lte_en,SOIL_LAB,SOIL_SAMPLING.Date,,,,,,,,,,,
,1192,EXPERIMENT,MEASURED_DATA,TIME_SERIES,SOIL_LAYERS,me_soil_layer_bot_depth,SLDLB,Soil layer depth to lower boundary of sample (bottom),cm,single,0,,bonares-lte_en,SOIL_LAB,SOIL_SAMPLING.Depth_max,,,,,,,,,,,
,1191,EXPERIMENT,MEASURED_DATA,TIME_SERIES,SOIL_LAYERS,me_soil_layer_top_depth,SLDUB,Soil layer depth to upper boundary of sample (top),cm,single,0,,bonares-lte_en,SOIL_LAB,SOIL_SAMPLING.Depth_min,,,,,,,,,,,
SOIL_METADATA,515,SOIL,SOIL_PROFILES,PROFILE_METADATA,,soil_location_country,SL_LOC_1,First admin for location of site for soil profile (usually country),text,text,,,dssat,SOIL_METADATA,COUNTRY,,,0,Country where soil profile is located,text,,,,,,metadata
SOIL_METADATA,522,SOIL,SOIL_PROFILES,PROFILE_METADATA,,soil_sampling_date,SOIL_DATE,"Date soil was sampled in field (e.g., for profile description)",date,date,,,dssat,SOIL_METADATA,DATE,,,0,"Sampling date, soil profile",,,,,,,Not unique attribute in DSSAT list; component of soil_id
SOIL_METADATA,523,SOIL,SOIL_PROFILES,PROFILE_METADATA,,soil_depth,SLDP,Soil depth,cm,single,0,,dssat,SOIL_METADATA,DEPTH,,,0,Soil depth,cm,,,,,,metadata
SOIL_METADATA,488,SOILS,SOIL_METADATA,GENERAL,,soil_notes,SL_NOTES,"Additional, detailed information that describes a soil dataset",text,memo,,,dssat,SOIL_METADATA,DESCRIPTION,,,0,Full description of the soil texture,text,,,,,,
SOIL_METADATA,518,SOIL,SOIL_PROFILES,PROFILE_METADATA,,latitude_soil_profile,SOIL_LAT,Latitude of soil profile site,degree,single,-80,80,dssat,SOIL_METADATA,LAT,,,1,"Latitude, degrees (decimals,+ve north)",degree,,,,,,metadata
SOIL_METADATA,519,SOIL,SOIL_PROFILES,PROFILE_METADATA,,longitude_soil_profile,SOIL_LONG,Longitude of soil profile site,degree,single,-180,180,dssat,SOIL_METADATA,LONG,,,1,"Longitude, degrees (decimals,+ve east)",degree,,,,,,metadata
SOIL_METADATA,511,SOIL,SOIL_PROFILES,PROFILE_METADATA,,soil_profile_ID,SOIL_ID,Soil profile identifier,text,text,,,dssat,SOIL_METADATA,PEDON,,,2,10-character identifier for the soil,text,,,,,,metadata
SOIL_PROFILES,531,SOIL,SOIL_PROFILES,SOIL_PROFILE,,soil_albedo,SALB,"Soil albedo, dry soil",,single,,,dssat,SOIL_METADATA,SALB,,,2,Albedo,,,,,,,header
SOIL_PROFILES,539,SOIL,SOIL_PROFILES,SOIL_PROFILE,,soil_surface_color,SSCOL,"Surface soil color, moist, using Munsell hue",,text,,,dssat,SOIL_METADATA,SCOM,,,1,"Color, moist (Munsell hue)",,,,,,,header
SOIL_PROFILES,529,SOIL,SOIL_PROFILES,SOIL_PROFILE,,soil_classification,CLASSIFICATION,Soil classification,text,text,,,dssat,SOIL_METADATA,SCS FAMILY,,,1,USDA soil classification system family,text,,,,,,metadata
SOIL_METADATA,514,SOIL,SOIL_PROFILES,PROFILE_METADATA,,soil_site,SOIL_SITE,Name of site where soil profile data sampled,text,text,,,dssat,SOIL_METADATA,SITE,,,0,Site name,text,,,,,,metadata
